{
  "schema_version": "0.1.0",
  "assertion_id": "TH.PLATO.AUTH.01a108c0-479d-7009-8abc-000000000029",
  "catalog_id": "TH.PLATO.CAT.EPINOMIS",
  "classification_system": "PLATO_AUTHENTICITY_AD_V1",
  "classification": "C",
  "assessment_status": "PROVISIONAL",
  "evidence": [
    {
      "source_ref": "https://www.rep.routledge.com/articles/biographical/plato-427-347-bc/v-1/sections/writings-4",
      "evidence_type": "MODERN_SCHOLARSHIP",
      "direction": "AGAINST_AUTHENTICITY",
      "note": "Schofield notes that Epinomis was already attributed in antiquity to Plato's pupil Philip of Opus."
    },
    {
      "source_ref": "https://doi.org/10.1093/oso/9780192893352.003.0005",
      "evidence_type": "MODERN_SCHOLARSHIP",
      "direction": "AGAINST_AUTHENTICITY",
      "note": "Jażdżewska treats Epinomis among the Thrasyllan dubia rather than genuine Platonic works."
    }
  ],
  "rationale": "Epinomis is traditionally attached to Laws but modern scholarship generally denies Platonic authorship; ancient testimony already associates it with Philip of Opus. It remains historically canonical, so C is the appropriate project grade.",
  "assessed_at": "2026-10-05T04:45:00Z",
  "supersedes_assertion_id": null,
  "runtime_visibility": "CUSTODIAN_ONLY"
}
