{
  "schema_version": "0.1.0",
  "assertion_id": "TH.PLATO.AUTH.01a10920-0009-7001-8abc-000000000009",
  "catalog_id": "TH.PLATO.CAT.EPISTLE_IX",
  "classification_system": "PLATO_AUTHENTICITY_AD_V1",
  "classification": "C",
  "assessment_status": "PROVISIONAL",
  "evidence": [
    {
      "source_ref": "https://www.viachrista.org/Library/Plato_Epistles_Loeb.html",
      "evidence_type": "LINGUISTIC",
      "direction": "AGAINST_AUTHENTICITY",
      "note": "Bury points to diction, chronology around Echecrates and the generic character of the letter as evidence for a later hand."
    },
    {
      "source_ref": "https://www.persee.fr/doc/reg_0035-2039_1936_num_49_231_2790_t2_0483_0000_1",
      "evidence_type": "EDITORIAL_HISTORY",
      "direction": "AGAINST_AUTHENTICITY",
      "note": "The review of Morrow includes Letter IX among the rejected or suspect letters."
    },
    {
      "source_ref": "https://doi.org/10.7591/cornell/9781501772894.001.0001",
      "evidence_type": "MODERN_SCHOLARSHIP",
      "direction": "SUPPORTS_AUTHENTICITY",
      "note": "Helfer's 2023 unified-reading thesis preserves a serious recent defense of the collection as a Platonic work."
    }
  ],
  "rationale": "Letter IX is repeatedly identified as one of the weakest claims within the canonical thirteen. Bury points to diction, chronology and the commonplace character of the text, and Morrow rejected or suspected it. Ancient citation by Cicero and recent literary-unity arguments prevent treating the matter as equivalent to extra-canonical spuria, but the modern balance remains strongly against Plato; C is appropriate.",
  "assessed_at": "2026-10-06T00:20:00Z",
  "supersedes_assertion_id": null,
  "runtime_visibility": "CUSTODIAN_ONLY"
}
