{
  "schema_version": "0.1.0",
  "assertion_id": "TH.PLATO.AUTH.01a108c0-479b-7002-8abc-000000000002",
  "catalog_id": "TH.PLATO.CAT.SISYPHUS",
  "classification_system": "PLATO_AUTHENTICITY_AD_V1",
  "classification": "D",
  "assessment_status": "PROVISIONAL",
  "evidence": [
    {
      "source_ref": "https://www.perseus.tufts.edu/hopper/text?doc=urn:cts:greekLit:tlg0004.tlg001.perseus-eng1:3.1",
      "evidence_type": "ANCIENT_REJECTION",
      "direction": "AGAINST_AUTHENTICITY",
      "note": "Diogenes Laertius III.62 explicitly includes Sisyphus in the list of dialogues acknowledged as spurious."
    },
    {
      "source_ref": "https://doi.org/10.1093/oso/9780192893352.003.0005",
      "evidence_type": "MODERN_SCHOLARSHIP",
      "direction": "AGAINST_AUTHENTICITY",
      "note": "Jażdżewska (2022) treats Sisyphus among pseudo-Platonic / Appendix Platonica dialogues."
    }
  ],
  "rationale": "Ancient testimony explicitly rejects Sisyphus as Platonic, and modern specialist discussion continues to treat it within the pseudo-Platonic corpus. D records authorship judgment only; the text remains historically relevant to the attribution catalog.",
  "assessed_at": "2026-10-04T21:45:00Z",
  "supersedes_assertion_id": null,
  "runtime_visibility": "CUSTODIAN_ONLY"
}
