{
  "schema_version": "0.1.0",
  "assertion_id": "TH.PLATO.AUTH.01a108c0-479d-7002-8abc-000000000022",
  "catalog_id": "TH.PLATO.CAT.HIPPIAS_MAJOR",
  "classification_system": "PLATO_AUTHENTICITY_AD_V1",
  "classification": "B",
  "assessment_status": "PROVISIONAL",
  "evidence": [
    {
      "source_ref": "https://www.rep.routledge.com/articles/biographical/plato-427-347-bc/v-1/sections/authenticity-and-chronology",
      "evidence_type": "MODERN_SCHOLARSHIP",
      "direction": "MIXED",
      "note": "Schofield lists Hippias Major among the major extended authenticity problems on which opinion remains divided."
    },
    {
      "source_ref": "https://plato.stanford.edu/entries/plato-ethics-shorter/",
      "evidence_type": "MODERN_SCHOLARSHIP",
      "direction": "MIXED",
      "note": "SEP surveys arguments on both sides and concludes that the authenticity case must be left not proven."
    }
  ],
  "rationale": "Hippias Major remains an unresolved authenticity case. Serious scholars defend Platonic authorship while others reject it, and the Stanford Encyclopedia explicitly concludes that the case is not proven. B therefore preserves the live scholarly dispute.",
  "assessed_at": "2026-10-05T04:45:00Z",
  "supersedes_assertion_id": null,
  "runtime_visibility": "CUSTODIAN_ONLY"
}
