{
  "schema_version": "0.1.0",
  "assertion_id": "TH.PLATO.AUTH.01a10930-0031-7001-8abc-000000000031",
  "catalog_id": "TH.PLATO.CAT.EXTRA_EPISTLE_HERCHER_31",
  "classification_system": "PLATO_AUTHENTICITY_AD_V1",
  "classification": "C",
  "assessment_status": "PROVISIONAL",
  "evidence": [
    {
      "source_ref": "https://doi.org/10.30965/9783657793891_012",
      "evidence_type": "MODERN_SCHOLARSHIP",
      "direction": "AGAINST_AUTHENTICITY",
      "note": "Forcignanò and Martinelli Tempesta place Hercher 31 among the extra-canonical Platonic epistles and discuss this material separately from the established thirteen-letter collection."
    },
    {
      "source_ref": "https://www.cambridge.org/core/journals/classical-quarterly/article/abs/putting-the-platonic-letters-in-order-a-pen-pal-breakup-and-the-legacy-of-dion/DDC0840A75BD5640B0628BE6D648E42A",
      "evidence_type": "EDITORIAL_HISTORY",
      "direction": "CONTEXT_ONLY",
      "note": "Hirsch (2026) explicitly enumerates Hercher 14, 15, 24, 25, 26, 30, 31, 70 and 85 as other letters of 'Plato' outside the thirteen-letter collection, pointing to the 2023 corpus-history treatment."
    },
    {
      "source_ref": "https://www.steiner-verlag.de/The-Letter-of-Speusippus-to-Philip-II/9783515083966",
      "evidence_type": "MODERN_SCHOLARSHIP",
      "direction": "SUPPORTS_AUTHENTICITY",
      "note": "Natoli (2004) argues that the Thirty-first Socratic Letter is likely to be a genuine work of Plato and uses it as evidence for Plato's involvement in Macedonian affairs."
    }
  ],
  "rationale": "The letter to Philip is probably inauthentic on balance, but Anthony Natoli published a substantial defense of its Platonic authorship; this prevents a D classification.",
  "assessed_at": "2026-10-06T00:40:00Z",
  "supersedes_assertion_id": null,
  "runtime_visibility": "CUSTODIAN_ONLY"
}
