{
  "schema_version": "0.1.0",
  "assertion_id": "TH.PLATO.AUTH.01a108c0-479d-7008-8abc-000000000028",
  "catalog_id": "TH.PLATO.CAT.MINOS",
  "classification_system": "PLATO_AUTHENTICITY_AD_V1",
  "classification": "C",
  "assessment_status": "PROVISIONAL",
  "evidence": [
    {
      "source_ref": "https://www.rep.routledge.com/articles/biographical/plato-427-347-bc/v-1/sections/writings-4",
      "evidence_type": "MODERN_SCHOLARSHIP",
      "direction": "AGAINST_AUTHENTICITY",
      "note": "Schofield explicitly calls Minos spurious."
    },
    {
      "source_ref": "https://doi.org/10.1093/oso/9780192893352.003.0005",
      "evidence_type": "MODERN_SCHOLARSHIP",
      "direction": "AGAINST_AUTHENTICITY",
      "note": "Jażdżewska treats Minos among the Thrasyllan dubia and as an outlier from genuine Platonic works."
    }
  ],
  "rationale": "Minos is widely treated as a spurious dialogue despite its position in Thrasyllus' ninth tetralogy. The project's C grade reflects probable inauthenticity within the ancient canon.",
  "assessed_at": "2026-10-05T04:45:00Z",
  "supersedes_assertion_id": null,
  "runtime_visibility": "CUSTODIAN_ONLY"
}
